{"$schema":"https://json-schema.org/draft/2020-12/schema","$id":"https://kaveep.dev/dev-agent/schemas/engineering-loop-request.schema.json","title":"KAVEEP DEV-AGENT Engineering Loop Request","type":"object","required":["loopRequestId","schemaVersion","sandboxId","manifestRef","brainRequest","maxAttempts","status","createdAt"],"properties":{"loopRequestId":{"type":"string","pattern":"^engineering_loop_request_[A-Za-z0-9][A-Za-z0-9_-]*$"},"schemaVersion":{"type":"string","const":"1.0.0"},"sandboxId":{"type":"string","pattern":"^sandbox_[A-Za-z0-9][A-Za-z0-9_-]*$"},"manifestRef":{"type":"string","minLength":1},"brainRequest":{"$ref":"engineering-brain-request.schema.json"},"maxAttempts":{"type":"integer","minimum":1,"maximum":5},"status":{"type":"string","const":"proposed"},"createdAt":{"type":"string","format":"date-time"}},"additionalProperties":false}
