{"loopRequestId":"engineering_loop_request_example_001","schemaVersion":"1.0.0","sandboxId":"sandbox_example_001","manifestRef":"C:/temp/kaveep-sandbox-example/sandbox-manifest.json","brainRequest":{"brainRequestId":"brain_request_example_001","schemaVersion":"1.0.0","providerId":"mock","model":"mock-model","requestRef":"request_example_001","planRef":"plan_example_001","contextRef":"context_example_001","objective":"Fix syntax.","contextFiles":[],"protectedPaths":["ENGINEERING-CONSTITUTION.md"],"budget":{"maxContextCharacters":10000,"maxOutputTokens":4000,"maxEdits":3,"timeoutMs":30000},"status":"proposed","createdAt":"2026-07-11T00:00:00.000Z"},"maxAttempts":3,"status":"proposed","createdAt":"2026-07-11T00:00:00.000Z"}
